[
 {
  "ref": "P1-A-1",
  "paper": "prelims-1",
  "clause": "IVC: features, sites, society, cultural history, art & religion",
  "subtopicIds": [
   "hist-ancient-ivc",
   "hist-art-architecture"
  ],
  "keywords": [
   "Harappa",
   "Mohenjo",
   "Indus",
   "Dholavira"
  ],
  "apSpecific": false
 },
 {
  "ref": "P1-A-1b",
  "paper": "prelims-1",
  "clause": "Vedic Age & Mahajanapadas",
  "subtopicIds": [
   "hist-ancient-early-vedic",
   "hist-ancient-later-vedic",
   "hist-ancient-mahajanapadas"
  ],
  "keywords": [
   "Vedic",
   "Rigveda",
   "Mahajanapada",
   "Aryans"
  ],
  "apSpecific": false
 },
 {
  "ref": "P1-A-1c",
  "paper": "prelims-1",
  "clause": "Religions — Jainism & Buddhism",
  "subtopicIds": [
   "hist-ancient-jainism",
   "hist-ancient-buddhism-1",
   "hist-ancient-buddhism-2"
  ],
  "keywords": [
   "Jainism",
   "Buddhism",
   "Mahavira",
   "Buddha"
  ],
  "apSpecific": false
 },
 {
  "ref": "P1-A-1d",
  "paper": "prelims-1",
  "clause": "Magadha, Mauryas, foreign invasions & Kushans",
  "subtopicIds": [
   "hist-ancient-rise-of-magadha",
   "hist-ancient-magadha-dynasties",
   "hist-ancient-mauryan",
   "hist-ancient-alexander",
   "hist-ancient-indo-greek",
   "hist-ancient-sakas-parthians",
   "hist-ancient-kushanas"
  ],
  "keywords": [
   "Magadha",
   "Maurya",
   "Ashoka",
   "Kushan",
   "Chandragupta"
  ],
  "apSpecific": false
 },
 {
  "ref": "P1-A-1e",
  "paper": "prelims-1",
  "clause": "Satavahanas, Sangam, Sungas, Guptas — admin/society/art/sci",
  "subtopicIds": [
   "hist-ancient-satavahanas",
   "hist-ancient-sungas-kanvas",
   "hist-ancient-sangam",
   "hist-ancient-guptas",
   "hist-ancient-harsha",
   "hist-ancient-post-gupta",
   "hist-art-literature-science"
  ],
  "keywords": [
   "Satavahana",
   "Sangam",
   "Gupta",
   "Harsha",
   "Sunga"
  ],
  "apSpecific": false
 },
 {
  "ref": "P1-A-2",
  "paper": "prelims-1",
  "clause": "Kanauj & South Indian dynasties (Chalukyas, Rashtrakutas, Cholas, Hoysalas, Yadavas, Kakatiyas, Reddis)",
  "subtopicIds": [
   "hist-medieval-kanauj-tripartite",
   "hist-medieval-south-indian-dynasties",
   "hist-ap-kakatiyas",
   "hist-ap-reddi-kingdoms"
  ],
  "keywords": [
   "Chola",
   "Rashtrakuta",
   "Chalukya",
   "Kakatiya",
   "Hoysala"
  ],
  "apSpecific": true
 },
 {
  "ref": "P1-A-3",
  "paper": "prelims-1",
  "clause": "Delhi Sultanate, Vijayanagar, Mughals, Bhakti & Sufism",
  "subtopicIds": [
   "hist-medieval-delhi-sultanate",
   "hist-medieval-vijayanagara-bahmani",
   "hist-medieval-mughal-empire",
   "hist-medieval-bhakti-sufi"
  ],
  "keywords": [
   "Sultanate",
   "Vijayanagara",
   "Mughal",
   "Bhakti",
   "Sufi"
  ],
  "apSpecific": false
 },
 {
  "ref": "P1-A-4",
  "paper": "prelims-1",
  "clause": "European trading companies, struggle for supremacy, Governor-Generals & Viceroys",
  "subtopicIds": [
   "hist-modern-european-companies",
   "hist-modern-governors-viceroys"
  ],
  "keywords": [
   "Company",
   "Governor",
   "Viceroy",
   "Dutch",
   "Portuguese"
  ],
  "apSpecific": false
 },
 {
  "ref": "P1-A-5",
  "paper": "prelims-1",
  "clause": "1857 War, 19th-c socio-religious reforms, Freedom Movement, revolutionaries",
  "subtopicIds": [
   "hist-modern-1857-revolt",
   "hist-modern-socio-religious-reforms",
   "hist-modern-freedom-movement",
   "hist-ap-andhra-freedom-movement"
  ],
  "keywords": [
   "1857",
   "revolt",
   "reform",
   "freedom",
   "nationalism"
  ],
  "apSpecific": true
 },
 {
  "ref": "P1-A-6",
  "paper": "prelims-1",
  "clause": "Gandhi, Patel, Bose, Ambedkar, reorganization of states",
  "subtopicIds": [
   "hist-modern-gandhi",
   "hist-modern-patel-bose",
   "hist-modern-ambedkar-constitution",
   "hist-modern-post-independence-integration",
   "hist-ap-andhra-movement-formation"
  ],
  "keywords": [
   "Gandhi",
   "Patel",
   "Bose",
   "Ambedkar",
   "reorganisation"
  ],
  "apSpecific": true
 },
 {
  "ref": "P1-B-1",
  "paper": "prelims-1",
  "clause": "Constitution: evolution, features, Preamble, FR, FD, DPSP, amendments, basic structure",
  "subtopicIds": [
   "pol-constitution-evolution",
   "pol-constitution-features-preamble",
   "pol-fundamental-rights",
   "pol-fundamental-duties",
   "pol-directive-principles",
   "pol-amendments-basic-structure"
  ],
  "keywords": [
   "Constitution",
   "Preamble",
   "Fundamental Rights",
   "Directive Principles",
   "amendment"
  ],
  "apSpecific": false
 },
 {
  "ref": "P1-B-2",
  "paper": "prelims-1",
  "clause": "Union/State functions, Parliament & State Legislatures, federalism & devolution",
  "subtopicIds": [
   "pol-union-executive-legislature",
   "pol-state-executive-legislature",
   "pol-union-state-relations",
   "pol-panchayati-raj"
  ],
  "keywords": [
   "Parliament",
   "Legislature",
   "federal",
   "Union",
   "State"
  ],
  "apSpecific": false
 },
 {
  "ref": "P1-B-3",
  "paper": "prelims-1",
  "clause": "Constitutional Authorities, Panchayati Raj, public policy & governance",
  "subtopicIds": [
   "pol-constitutional-authorities",
   "pol-panchayati-raj",
   "pol-governance-egovernance"
  ],
  "keywords": [
   "Panchayati",
   "governance",
   "authorities",
   "policy"
  ],
  "apSpecific": false
 },
 {
  "ref": "P1-B-4",
  "paper": "prelims-1",
  "clause": "LPG impact on governance; statutory, regulatory & quasi-judicial bodies",
  "subtopicIds": [
   "pol-lpg-impact",
   "pol-statutory-regulatory-bodies"
  ],
  "keywords": [
   "liberalisation",
   "regulatory",
   "statutory",
   "quasi-judicial"
  ],
  "apSpecific": false
 },
 {
  "ref": "P1-B-5",
  "paper": "prelims-1",
  "clause": "Rights issues (human, women, SC/ST, child)",
  "subtopicIds": [
   "pol-rights-issues"
  ],
  "keywords": [
   "rights",
   "women",
   "child",
   "human rights"
  ],
  "apSpecific": false
 },
 {
  "ref": "P1-B-6",
  "paper": "prelims-1",
  "clause": "Foreign policy, IR, institutions/agencies/fora, central & state policies",
  "subtopicIds": [
   "pol-foreign-policy-ir",
   "pol-international-institutions",
   "pol-policies-programmes"
  ],
  "keywords": [
   "foreign policy",
   "international",
   "relations",
   "policy"
  ],
  "apSpecific": false
 },
 {
  "ref": "P1-C-1",
  "paper": "prelims-1",
  "clause": "Basic characteristics, planning, NITI Aayog, HDI, sustainable dev, env policy",
  "subtopicIds": [
   "econ-characteristics-development",
   "econ-planning-niti-aayog",
   "econ-human-sustainable-development",
   "econ-environment-policy"
  ],
  "keywords": [
   "planning",
   "NITI",
   "sustainable",
   "HDI",
   "environment"
  ],
  "apSpecific": false
 },
 {
  "ref": "P1-C-2",
  "paper": "prelims-1",
  "clause": "National income, demographics, poverty, unemployment, rural & urban dev",
  "subtopicIds": [
   "econ-national-income",
   "econ-poverty-unemployment",
   "econ-rural-urban-development"
  ],
  "keywords": [
   "national income",
   "poverty",
   "unemployment",
   "urban",
   "rural"
  ],
  "apSpecific": false
 },
 {
  "ref": "P1-C-3",
  "paper": "prelims-1",
  "clause": "Agriculture, MSP, food security, industry, Make-in-India, SEZ, reforms, WTO",
  "subtopicIds": [
   "econ-agriculture",
   "econ-industry",
   "econ-reforms-trade-wto"
  ],
  "keywords": [
   "agriculture",
   "MSP",
   "industry",
   "SEZ",
   "WTO"
  ],
  "apSpecific": false
 },
 {
  "ref": "P1-C-4",
  "paper": "prelims-1",
  "clause": "RBI & monetary policy, banking/NPA, SEBI, tax/GST, centre-state finance, budget",
  "subtopicIds": [
   "econ-rbi-banking-markets",
   "econ-fiscal-budget-gst"
  ],
  "keywords": [
   "RBI",
   "monetary",
   "banking",
   "GST",
   "budget"
  ],
  "apSpecific": false
 },
 {
  "ref": "P1-C-5i",
  "paper": "prelims-1",
  "clause": "AP economy after 2014 bifurcation — resources, infra, agri, welfare",
  "subtopicIds": [
   "econ-ap-economy-bifurcation"
  ],
  "keywords": [
   "Andhra",
   "bifurcation",
   "infrastructure",
   "welfare"
  ],
  "apSpecific": true
 },
 {
  "ref": "P1-C-5ii",
  "paper": "prelims-1",
  "clause": "AP Reorganisation Act 2014 — economic issues, special status",
  "subtopicIds": [
   "econ-ap-reorganisation-act"
  ],
  "keywords": [
   "Reorganisation Act",
   "special category",
   "Polavaram",
   "bifurcation"
  ],
  "apSpecific": true
 },
 {
  "ref": "P1-D-1",
  "paper": "prelims-1",
  "clause": "General geography — earth/solar system, motions, structure, atmosphere, oceans",
  "subtopicIds": [
   "geo-earth-solar-system",
   "geo-landforms-structure",
   "geo-atmosphere-climatology",
   "geo-oceans-marine-resources"
  ],
  "keywords": [
   "earth",
   "solar",
   "atmosphere",
   "ocean",
   "climate"
  ],
  "apSpecific": false
 },
 {
  "ref": "P1-D-2",
  "paper": "prelims-1",
  "clause": "Physical — divisions, earthquakes, drainage, monsoon, vegetation, soils, minerals",
  "subtopicIds": [
   "geo-physical-india",
   "geo-physical-andhra-pradesh",
   "geo-landforms-structure"
  ],
  "keywords": [
   "monsoon",
   "drainage",
   "soil",
   "mineral",
   "vegetation"
  ],
  "apSpecific": true
 },
 {
  "ref": "P1-D-3",
  "paper": "prelims-1",
  "clause": "Social — distribution, density, sex ratio, literacy, SC/ST, urbanization, migration",
  "subtopicIds": [
   "geo-social-geography"
  ],
  "keywords": [
   "density",
   "literacy",
   "sex ratio",
   "migration",
   "urbanization"
  ],
  "apSpecific": false
 },
 {
  "ref": "P1-D-4",
  "paper": "prelims-1",
  "clause": "Economic — sectors, agriculture, industry, services, transport & trade",
  "subtopicIds": [
   "geo-economic-geography"
  ],
  "keywords": [
   "agriculture",
   "industry",
   "transport",
   "trade",
   "tertiary"
  ],
  "apSpecific": false
 },
 {
  "ref": "P2-A-1",
  "paper": "prelims-2",
  "clause": "Logical reasoning & analytical ability",
  "subtopicIds": [
   "ment-logical-reasoning"
  ],
  "keywords": [
   "reasoning",
   "analytical",
   "logical"
  ],
  "apSpecific": false
 },
 {
  "ref": "P2-A-2",
  "paper": "prelims-2",
  "clause": "Number series, coding-decoding",
  "subtopicIds": [